<?xml version="1.0"?>
<xs:schema xmlns:xs="http://www.w3.org/2001/XMLSchema"
           targetNamespace="https://www.w3schools.com"
           xmlns="https://www.w3schools.com"
           elementFormDefault="qualified">
    <xs:element name="biblioteca">
        <xs:complexType>
            <xs:sequence>
                <xs:element name="livros">
                    <xs:complexType>
                        <xs:sequence>
                            <xs:element name="livro" maxOccurs="unbounded">
                                <xs:complexType>
                                    <xs:sequence>
                                        <xs:element name="titulo" type="xs:string" />
                                        <xs:element name="autor" type="xs:string" />
                                        <xs:element name="ano" type="xs:int" />
                                        <xs:element name="preco" type="xs:decimal"/>
                                    </xs:sequence>
                                    <xs:attribute name="isbn" type="xs:string" use="required"/>
                                </xs:complexType>
                            </xs:element>
                        </xs:sequence>
                    </xs:complexType>
                </xs:element>
            </xs:sequence>
        </xs:complexType>
    </xs:element>
</xs:schema>
